{
  "task_id": "codex-fixed-subagent-delegation-20260407-145034-kewd",
  "dispatch_packet_id": "DP-P5-ROUTING-UPGRADE-001",
  "work_order_id": "WO-P5-ROUTING-UPGRADE-001",
  "instruction_source": "docs/plans/codex-fixed-subagent-delegation.md",
  "read_before_write": [
    "docs/plans/codex-fixed-subagent-delegation.md",
    "agents/codex-role-map.json",
    "agents/README.md",
    "agents/manifest.json",
    "skills/global-task-orchestrator/SKILL.md",
    "skills/global-task-orchestrator/references/agent-selection-matrix.md",
    "skills/global-task-orchestrator/references/dynamic-routing-rules.md",
    "skills/global-task-orchestrator/references/orchestration-examples.md"
  ],
  "execution_order": [
    "先新增 reader/reviewer 角色文件并更新 manifest。",
    "再更新 agents/README.md 的 catalog 与选择原则。",
    "再更新 SKILL.md 与三份 references 路由文档。",
    "完成后自检并写入 return_packet。"
  ],
  "change_spec": [
    {
      "path": "agents/reader.md",
      "change_type": "create",
      "instructions": [
        "使用统一 8 段结构定义 reader。",
        "明确只读边界与结构化回报字段。"
      ]
    },
    {
      "path": "agents/reviewer.md",
      "change_type": "create",
      "instructions": [
        "使用统一 8 段结构定义 reviewer。",
        "明确 findings 优先与默认不直接修复。"
      ]
    },
    {
      "path": "agents/manifest.json",
      "change_type": "update",
      "instructions": [
        "增加 reader/reviewer 条目并保持结构一致。"
      ]
    },
    {
      "path": "agents/README.md",
      "change_type": "update",
      "instructions": [
        "catalog 与选择原则纳入 reader/reviewer。"
      ]
    },
    {
      "path": "skills/global-task-orchestrator/SKILL.md",
      "change_type": "update",
      "instructions": [
        "默认路由按角色优先，显式 reader/reviewer 触发条件。"
      ]
    },
    {
      "path": "skills/global-task-orchestrator/references/agent-selection-matrix.md",
      "change_type": "update",
      "instructions": [
        "补齐 reader/reviewer 与 role-map 消费规则。"
      ]
    },
    {
      "path": "skills/global-task-orchestrator/references/dynamic-routing-rules.md",
      "change_type": "update",
      "instructions": [
        "补齐 reader/reviewer 在动态分支中的触发和回退。"
      ]
    },
    {
      "path": "skills/global-task-orchestrator/references/orchestration-examples.md",
      "change_type": "update",
      "instructions": [
        "补 reader/reviewer 的编排样例。"
      ]
    }
  ],
  "invariants": [
    "保持先方案再文档再测试再代码的默认顺序。",
    "路由入口从裸类型切换到角色，不新增平台 agent_type。",
    "不触发阶段6/7文件改造。"
  ],
  "forbidden_changes": [
    "不得修改 scripts/*.ps1。",
    "不得修改 templates/*.json 与 schemas/*.json。",
    "不得由主协调器代写 return_packet 正文。"
  ],
  "dependency_notes": [
    "reader/reviewer 角色定义需与阶段2 role-map 一致。",
    "若角色定义与 map 冲突，需 blocked 回退。"
  ],
  "done_signals": [
    "reader/reviewer 真源已落盘。",
    "manifest/catalog/路由文档已对齐。",
    "return_packet 由执行子代理本人写入。"
  ],
  "verification_focus": [
    "reader/reviewer 文件结构完整。",
    "manifest 含 reader/reviewer 条目。",
    "SKILL 与 references 路由规则一致。",
    "无越界写入。"
  ],
  "fallback_strategy": [
    "若发现跨阶段改动需求，停止并回退主协调器。",
    "若 reader/reviewer 无法与 role-map 对齐，返回 blocked。"
  ],
  "handoff_notes": [
    "required_return_fields 全量必填。",
    "verification_commands 与 verification_result 需可复核。",
    "written_by/written_role 必须是执行子代理本人。"
  ]
}
