{
  "task_id": "20260402-batch25-plan-dual-track-upgrade",
  "dispatch_packet_id": "DP-B25-PLAN-DUAL-001-R1",
  "work_order_id": "WO-B25-PLAN-DUAL-001-R1",
  "instruction_source": "docs/CONTRACT_FIRST_DISPATCH_PLAN.md",
  "read_before_write": [
    "docs/CONTRACT_FIRST_DISPATCH_PLAN.md",
    "docs/SUBAGENT_GOVERNANCE.md",
    "rules/common/SUBAGENT_RULES.md",
    "docs/ai/runs/20260402-batch25-plan-dual-track-upgrade/work_orders/WO-B25-PLAN-DUAL-001.json",
    "docs/ai/runs/20260402-batch25-plan-dual-track-upgrade/dispatch_packets/DP-B25-PLAN-DUAL-001.json",
    "docs/ai/runs/20260402-batch25-plan-dual-track-upgrade/return_packets/RP-B25-PLAN-DUAL-001.json",
    "docs/ai/runs/20260402-batch25-plan-dual-track-upgrade/review_report_r1.md"
  ],
  "execution_order": [
    "Inspect the explicit smoke artifact paths",
    "Delete the allowed temporary artifact directories and markdown files",
    "Amend the original return packet",
    "Write the rework return packet",
    "Verify the explicit smoke artifact paths are gone and both return packets parse"
  ],
  "change_spec": [
    {
      "path": "docs/ai/runs/batch25-smoke-* + docs/plans/batch25-smoke-*.md + .ai/session/batch25-smoke-*",
      "change_type": "delete",
      "instructions": [
        "Delete only the three known smoke task artifact sets: 20260402, 20260402b, and 20260402c.",
        "Check the resolved absolute paths before any recursive delete."
      ],
      "done_when": [
        "The explicit smoke artifact sets no longer exist."
      ]
    },
    {
      "path": "docs/ai/runs/20260402-batch25-plan-dual-track-upgrade/return_packets/RP-B25-PLAN-DUAL-001.json",
      "change_type": "update",
      "instructions": [
        "Record that temporary smoke artifacts were created during validation and cleaned during rework.",
        "Preserve the original functional validation facts."
      ],
      "done_when": [
        "The original return packet is truthful about the temporary validation writes."
      ]
    },
    {
      "path": "docs/ai/runs/20260402-batch25-plan-dual-track-upgrade/return_packets/RP-B25-PLAN-DUAL-001-R1.json",
      "change_type": "create",
      "instructions": [
        "Write the rework receipt with cleanup facts, commands, and remaining risks."
      ],
      "done_when": [
        "The rework receipt exists and is JSON-parse valid."
      ]
    }
  ],
  "invariants": [
    "Do not change the accepted Batch 2.5 logic.",
    "Delete only explicit temporary smoke artifacts inside the repository.",
    "Keep receipt history truthful and compressed."
  ],
  "forbidden_changes": [
    "Do not touch prompts, governance docs, or later batch files.",
    "Do not delete any non-batch25-smoke path.",
    "Do not change orchestration logs or session logs."
  ],
  "dependency_notes": [
    "The blocker is governance cleanup, not the Batch 2.5 functional implementation.",
    "The original return packet must remain historically useful while no longer hiding the temporary validation outputs."
  ],
  "done_signals": [
    "All explicit smoke artifact paths are gone.",
    "The original return packet is amended.",
    "The rework return packet is written.",
    "Both return packet JSON files parse cleanly."
  ],
  "verification_focus": [
    "Cleanup stays within the explicit smoke artifact set.",
    "Receipt accounting is now truthful.",
    "No accepted implementation file was altered."
  ],
  "fallback_strategy": [
    "If any target path does not resolve exactly as expected, stop instead of deleting.",
    "If amending the original return packet would distort accepted facts, keep the facts intact and explain the difference in the rework receipt."
  ],
  "handoff_notes": [
    "The review agent should check both cleanup completeness and receipt truthfulness.",
    "Acceptance should fail again if any batch25-smoke artifact remains."
  ]
}
