{
  "task_id": "codex-fixed-subagent-delegation-20260407-145034-kewd",
  "dispatch_packet_id": "DP-P7-PROJECT-ADAPTATION-001",
  "work_order_id": "WO-P7-PROJECT-ADAPTATION-001",
  "instruction_source": "docs/plans/codex-fixed-subagent-delegation.md",
  "read_before_write": [
    "docs/AGENTS.md",
    "docs/SUBAGENT_GOVERNANCE.md",
    "templates/project/README.md",
    "templates/project/docs/README.md",
    "templates/project/config/README.md",
    "templates/project/.claude/README.md",
    "templates/project/.codex/README.md"
  ],
  "execution_order": [
    "先更新 docs/AGENTS.md。",
    "再更新 templates/project 现有 README 体系。",
    "最后新增 templates/project/docs/ai/README.md 与 templates/project/config/ai/README.md。",
    "执行校验并写 return_packet。"
  ],
  "change_spec": [
    {
      "path": "docs/AGENTS.md",
      "change_type": "update",
      "instructions": [
        "更新全局入口口径为角色优先委派。"
      ]
    },
    {
      "path": "templates/project/README.md",
      "change_type": "update",
      "instructions": [
        "补项目接入 role-first 最小步骤。"
      ]
    },
    {
      "path": "templates/project/docs/README.md",
      "change_type": "update",
      "instructions": [
        "补 docs/ai 接入入口说明。"
      ]
    },
    {
      "path": "templates/project/config/README.md",
      "change_type": "update",
      "instructions": [
        "补 config/ai 覆盖边界说明。"
      ]
    },
    {
      "path": "templates/project/.claude/README.md",
      "change_type": "update",
      "instructions": [
        "补项目侧 Claude 适配说明。"
      ]
    },
    {
      "path": "templates/project/.codex/README.md",
      "change_type": "update",
      "instructions": [
        "补项目侧 Codex 适配说明。"
      ]
    },
    {
      "path": "templates/project/docs/ai/README.md",
      "change_type": "create",
      "instructions": [
        "新增项目 docs/ai 入口文件。"
      ]
    },
    {
      "path": "templates/project/config/ai/README.md",
      "change_type": "create",
      "instructions": [
        "新增项目 config/ai 入口文件。"
      ]
    }
  ],
  "invariants": [
    "项目模板仅保留增量边界，不复制全局治理正文。",
    "不修改脚本/测试/schema。",
    "不回退已冻结阶段产物。"
  ],
  "forbidden_changes": [
    "不得修改 skills/global-task-orchestrator/scripts/*。",
    "不得修改 tests/*。",
    "不得由主协调器代写 return_packet 正文。"
  ],
  "dependency_notes": [
    "阶段7是入口适配收口，内容应引用前序阶段已冻结结论。"
  ],
  "done_signals": [
    "docs/AGENTS.md 与模板入口文档同步完成。",
    "docs/ai 与 config/ai 入口文件已创建。",
    "return_packet 由执行子代理本人写入。"
  ],
  "verification_focus": [
    "新增入口文件存在且非空。",
    "入口文档明确引用全局治理真源。",
    "无越界写入。"
  ],
  "fallback_strategy": [
    "若发现需要脚本改造，返回 blocked。",
    "若发现入口定义与冻结方案冲突，返回 blocked。"
  ],
  "handoff_notes": [
    "required_return_fields 全量必填。",
    "验证命令与结果可复核。",
    "written_by/written_role 必须是执行子代理本人。"
  ]
}
