{
  "task_id": "20260402-batch25-plan-dual-track-upgrade",
  "dispatch_packet_id": "DP-B25-PLAN-DUAL-001-R2",
  "work_order_id": "WO-B25-PLAN-DUAL-001-R2",
  "instruction_source": "docs/CONTRACT_FIRST_DISPATCH_PLAN.md",
  "read_before_write": [
    "docs/CONTRACT_FIRST_DISPATCH_PLAN.md",
    "docs/SUBAGENT_GOVERNANCE.md",
    "rules/common/SUBAGENT_RULES.md",
    "schemas/plan.schema.json",
    "templates/plan.example.json",
    "skills/global-task-orchestrator/scripts/validate-control-plane.ps1",
    "docs/ai/runs/20260402-batch25-plan-dual-track-upgrade/return_packets/RP-B25-PLAN-DUAL-001.json",
    "docs/ai/runs/20260402-batch25-plan-dual-track-upgrade/return_packets/RP-B25-PLAN-DUAL-001-R1.json",
    "docs/ai/runs/20260402-batch25-plan-dual-track-upgrade/review_report_r2.md"
  ],
  "execution_order": [
    "Create the missing run plan.json",
    "Amend RP-B25-PLAN-DUAL-001.json",
    "Amend RP-B25-PLAN-DUAL-001-R1.json",
    "Write RP-B25-PLAN-DUAL-001-R2.json",
    "Run validate-control-plane on task_id 20260402-batch25-plan-dual-track-upgrade"
  ],
  "change_spec": [
    {
      "path": "docs/ai/runs/20260402-batch25-plan-dual-track-upgrade/plan.json",
      "change_type": "create",
      "instructions": [
        "Use the canonical plan projection shape from plan.schema.json and plan.example.json.",
        "Align the content with the accepted Batch 2.5 scope and source_plan_doc."
      ],
      "done_when": [
        "plan.json exists and satisfies validator-required fields."
      ]
    },
    {
      "path": "docs/ai/runs/20260402-batch25-plan-dual-track-upgrade/return_packets/RP-B25-PLAN-DUAL-001.json",
      "change_type": "update",
      "instructions": [
        "Add return_packet_id and task_id only.",
        "Preserve accepted factual content."
      ],
      "done_when": [
        "The validator-required fields are present."
      ]
    },
    {
      "path": "docs/ai/runs/20260402-batch25-plan-dual-track-upgrade/return_packets/RP-B25-PLAN-DUAL-001-R1.json",
      "change_type": "update",
      "instructions": [
        "Add return_packet_id and task_id only.",
        "Preserve accepted factual content."
      ],
      "done_when": [
        "The validator-required fields are present."
      ]
    },
    {
      "path": "docs/ai/runs/20260402-batch25-plan-dual-track-upgrade/return_packets/RP-B25-PLAN-DUAL-001-R2.json",
      "change_type": "create",
      "instructions": [
        "Write the final receipt for this metadata-completion pass."
      ],
      "done_when": [
        "The R2 receipt exists and parses cleanly."
      ]
    }
  ],
  "invariants": [
    "Do not change accepted Batch 2.5 implementation logic.",
    "Keep receipt narratives truthful and minimal.",
    "Keep the run plan tied to docs/CONTRACT_FIRST_DISPATCH_PLAN.md as source_plan_doc."
  ],
  "forbidden_changes": [
    "Do not reopen smoke cleanup.",
    "Do not touch schema, template, or script implementation files.",
    "Do not edit work orders, dispatch packets, orchestration logs, or session logs."
  ],
  "dependency_notes": [
    "The current validator must pass on the Batch 2.5 run directory except for the known repo_doctor warning.",
    "Receipt field completion should not alter accepted functional claims."
  ],
  "done_signals": [
    "plan.json exists in the run directory",
    "Both existing return packets include return_packet_id and task_id",
    "R2 return packet exists",
    "validate-control-plane passes for task_id 20260402-batch25-plan-dual-track-upgrade"
  ],
  "verification_focus": [
    "Run self-validation succeeds",
    "Receipt metadata is complete",
    "No accepted implementation scope was reopened"
  ],
  "fallback_strategy": [
    "If validate fails for a new reason, stop and report blocked.",
    "If any receipt change would distort accepted facts, keep the facts and explain the conflict in the R2 receipt."
  ],
  "handoff_notes": [
    "The review agent should re-run the acceptance gate against the now self-validatable run directory."
  ]
}
