{
  "task_id": "contract-first-dispatch-batch3-4-20260403-153206-gtm2",
  "dispatch_packet_id": "DP-B35-HYDRATE-GATE-001",
  "work_order_id": "WO-B35-HYDRATE-GATE-001",
  "instruction_source": "docs/plans/contract-first-dispatch.md",
  "read_before_write": [
    "docs/plans/contract-first-dispatch.md",
    "docs/plans/contract-first-dispatch-batch3-4-20260403-153206-gtm2.plan.json",
    "docs/ai/runs/contract-first-dispatch-batch3-4-20260403-153206-gtm2/plan.json",
    "docs/SUBAGENT_GOVERNANCE.md",
    "skills/global-task-orchestrator/SKILL.md",
    "skills/global-task-orchestrator/scripts/ensure-work-order-fields.ps1",
    "skills/global-task-orchestrator/scripts/ensure-return-packet-fields.ps1",
    "templates/work_order.example.json",
    "templates/return_packet.example.json"
  ],
  "execution_order": [
    "更新 `ensure-work-order-fields.ps1`",
    "更新 `ensure-return-packet-fields.ps1`",
    "运行关键短语检查",
    "写入 return_packet"
  ],
  "change_spec": [
    {
      "path": "skills/global-task-orchestrator/scripts/ensure-work-order-fields.ps1",
      "change_type": "update",
      "instructions": [
        "把模糊占位 `dispatch_message_raw` 回填改成最小稳定中文文本。",
        "把默认 `required_return_fields` 提升到 v2 列表。"
      ],
      "done_when": [
        "work_order hydrate 不再回填无效占位语句。"
      ]
    },
    {
      "path": "skills/global-task-orchestrator/scripts/ensure-return-packet-fields.ps1",
      "change_type": "update",
      "instructions": [
        "补齐 v2 回执字段兜底。",
        "保持只做结构性补齐，不代写正文。"
      ],
      "done_when": [
        "return packet hydrate 能对齐 v2 结构兜底。"
      ]
    }
  ],
  "invariants": [
    "不新增 action。",
    "不修改 validate 逻辑。",
    "不代写执行事实正文。"
  ],
  "forbidden_changes": [
    "不要修改 `validate-control-plane.ps1`。",
    "不要修改任何 `templates/*.json` 或 prompt 真源。",
    "不要修改 `orchestrator_ctl.ps1`。"
  ],
  "dependency_notes": [
    "先稳定 work_order hydrate，再稳定 return_packet hydrate。",
    "默认兜底文本需要与 Batch 3.5 冻结规则一致。"
  ],
  "done_signals": [
    "两个 hydrate 脚本均更新完成。",
    "关键短语检查通过。",
    "return_packet 已落盘。"
  ],
  "verification_focus": [
    "是否移除了模糊占位回填。",
    "是否补齐 v2 回执字段。",
    "是否保持结构性兜底边界。"
  ],
  "fallback_strategy": [
    "若必须新增脚本 action，立即停止并回主协调器。",
    "若需要代写执行正文才能继续，立即停止。"
  ],
  "handoff_notes": [
    "审查时重点看默认回填文本与 required_return_fields 是否已达到 Batch 3.5 目标。",
    "回执中说明本次只补结构，不补执行事实。"
  ],
  "execution_steps": [
    "保留给旧消费者的兼容字段；以 `execution_order` 为准。"
  ],
  "verification_steps": [
    "保留给旧消费者的兼容字段；以 `verification_focus` 为准。"
  ],
  "stop_conditions": [
    "保留给旧消费者的兼容字段；以 `fallback_strategy` 与 `work_order.stop_conditions` 为准。"
  ]
}
