{
  "task_id": "codex-fixed-subagent-delegation-20260407-145034-kewd",
  "dispatch_packet_id": "DP-P1-ROLE-NORMALIZATION-001",
  "work_order_id": "WO-P1-ROLE-NORMALIZATION-001",
  "instruction_source": "docs/plans/codex-fixed-subagent-delegation.md",
  "read_before_write": [
    "docs/plans/codex-fixed-subagent-delegation.md",
    "docs/ai/runs/codex-fixed-subagent-delegation-20260407-145034-kewd/plan.json",
    ".ai/session/codex-fixed-subagent-delegation-20260407-145034-kewd/task_plan.md",
    ".ai/session/codex-fixed-subagent-delegation-20260407-145034-kewd/findings.md",
    ".ai/session/codex-fixed-subagent-delegation-20260407-145034-kewd/progress.md",
    "agents/README.md",
    "agents/_schema.example.md",
    "agents/manifest.json",
    "agents/planner.md",
    "agents/doc-curator.md",
    "agents/test-verifier.md",
    "agents/backend-implementer.md",
    "agents/frontend-implementer.md",
    "agents/ops-runbook.md"
  ],
  "execution_order": [
    "对照 plan 与 session 证据，先确定阶段1验收口径。",
    "先修订 agents/README.md 与 agents/_schema.example.md，冻结统一口径。",
    "再按统一口径修订六个角色文件（planner/doc-curator/test-verifier/backend/frontend/ops）。",
    "完成后执行自检并写入 return_packet。"
  ],
  "change_spec": [
    {
      "path": "agents/README.md",
      "change_type": "update",
      "instructions": [
        "将阶段1验收口径写成可执行条目，明确标准输入包含 work_order。",
        "统一主协调器验收门禁与回收口径的文案。"
      ],
      "done_when": [
        "README 能作为阶段1统一规范入口。"
      ]
    },
    {
      "path": "agents/_schema.example.md",
      "change_type": "update",
      "instructions": [
        "确保输入/输出/停止条件/协作交接样例与阶段1目标一致。",
        "明确可被六个角色文件直接套用的最小约束。"
      ],
      "done_when": [
        "schema 样例可直接驱动角色文件收敛。"
      ]
    },
    {
      "path": "agents/planner.md",
      "change_type": "update",
      "instructions": [
        "按统一 schema 补齐输入字段、停止条件、协作交接。"
      ]
    },
    {
      "path": "agents/doc-curator.md",
      "change_type": "update",
      "instructions": [
        "按统一 schema 补齐输入字段、停止条件、协作交接。"
      ]
    },
    {
      "path": "agents/test-verifier.md",
      "change_type": "update",
      "instructions": [
        "按统一 schema 补齐输入字段、停止条件、协作交接。"
      ]
    },
    {
      "path": "agents/backend-implementer.md",
      "change_type": "update",
      "instructions": [
        "按统一 schema 补齐输入字段、停止条件、协作交接。"
      ]
    },
    {
      "path": "agents/frontend-implementer.md",
      "change_type": "update",
      "instructions": [
        "按统一 schema 补齐输入字段、停止条件、协作交接。"
      ]
    },
    {
      "path": "agents/ops-runbook.md",
      "change_type": "update",
      "instructions": [
        "按统一 schema 补齐输入字段、停止条件、协作交接。"
      ]
    }
  ],
  "invariants": [
    "只处理阶段1：角色层规范化。",
    "角色定义与底层 agent_type 不混写。",
    "说明性文本默认中文，机器字段保持原样。",
    "completion_gate 仍为 return_packet_written_and_accepted。"
  ],
  "forbidden_changes": [
    "不得修改 agents/codex-role-map.json 或进入阶段2。",
    "不得修改 schemas/*.json 或 orchestrator 脚本。",
    "不得修改 write_paths 之外文件。",
    "不得由主协调器代写 return_packet 正文。"
  ],
  "dependency_notes": [
    "README 与 schema 是角色文件的上游约束，必须先更新再更新角色文件。",
    "若发现阶段1目标依赖阶段2映射决策，立即 blocked 回退。"
  ],
  "done_signals": [
    "8 个目标文件按统一口径完成修订。",
    "阶段1验收条目逐项满足并记录验证结果。",
    "return_packet 已由执行子代理本人写入固定路径。"
  ],
  "verification_focus": [
    "六个角色文件是否都显式包含 frozen_plan 与 work_order 输入口径。",
    "停止条件和协作交接是否显式出现主协调器验收门禁。",
    "是否完全未触及阶段2与映射文件。"
  ],
  "fallback_strategy": [
    "若冻结 plan 与当前改法冲突，停止并回退主协调器。",
    "若需要越界写文件，停止并返回 blocked_by。",
    "若存在事实不清或证据不足，先补证据再继续。"
  ],
  "handoff_notes": [
    "交付必须附 return_packet 最小字段全集。",
    "deviations_from_dispatch、blocked_by、follow_up_needed 即使为空也要保留字段。",
    "return_packet 的 written_by 与 written_role 必须是执行子代理本人。"
  ],
  "execution_steps": [
    "先读后写，严格按 execution_order 执行。"
  ],
  "verification_steps": [
    "按 verification_focus 做逐项文本校验并写入 return_packet。"
  ],
  "stop_conditions": [
    "出现阶段边界冲突、越权写入需求或冻结语义不一致。"
  ]
}
