{
  "task_id": "codex-fixed-subagent-delegation-20260407-145034-kewd",
  "dispatch_packet_id": "DP-P4-DISPATCH-COMPILER-001",
  "work_order_id": "WO-P4-DISPATCH-COMPILER-001",
  "instruction_source": "docs/plans/codex-fixed-subagent-delegation.md",
  "read_before_write": [
    "docs/plans/codex-fixed-subagent-delegation.md",
    "docs/ai/runs/codex-fixed-subagent-delegation-20260407-145034-kewd/plan.json",
    "agents/codex-role-map.json",
    "skills/global-task-orchestrator/scripts/control-plane-common.ps1",
    "skills/global-task-orchestrator/scripts/compile-dispatch-message.ps1",
    "skills/global-task-orchestrator/assets/prompts/execution-dispatch-template.md",
    "skills/global-task-orchestrator/assets/prompts/review-dispatch-template.md",
    "skills/global-task-orchestrator/assets/prompts/work-order-generator.md"
  ],
  "execution_order": [
    "先在 control-plane-common.ps1 做兼容编译增强。",
    "再同步 compile-dispatch-message.ps1 入口行为。",
    "再更新 execution/review/work-order 三份提示模板。",
    "编译阶段4工单并执行 validate，最后写入 return_packet。"
  ],
  "change_spec": [
    {
      "path": "skills/global-task-orchestrator/scripts/control-plane-common.ps1",
      "change_type": "update",
      "instructions": [
        "新增可选 role_source_path/role_map_path 的解析与输出逻辑。",
        "缺省时保持旧编译文本稳定。"
      ]
    },
    {
      "path": "skills/global-task-orchestrator/scripts/compile-dispatch-message.ps1",
      "change_type": "update",
      "instructions": [
        "确保新字段可参与编译且 -WriteBack 行为不变。"
      ]
    },
    {
      "path": "skills/global-task-orchestrator/assets/prompts/execution-dispatch-template.md",
      "change_type": "update",
      "instructions": [
        "补充角色真源与映射层参与编译的提示语。"
      ]
    },
    {
      "path": "skills/global-task-orchestrator/assets/prompts/review-dispatch-template.md",
      "change_type": "update",
      "instructions": [
        "补充 reviewer 场景下的编译输入要求。"
      ]
    },
    {
      "path": "skills/global-task-orchestrator/assets/prompts/work-order-generator.md",
      "change_type": "update",
      "instructions": [
        "补充 role_source_path/role_map_path 可选字段生成说明。"
      ]
    }
  ],
  "invariants": [
    "历史工单默认兼容，不强制立刻重编译旧文件。",
    "不修改阶段5+文件。",
    "不修改模板/schema。"
  ],
  "forbidden_changes": [
    "不得修改 agents/*.md 与 agents/codex-role-map.json。",
    "不得修改 templates/*.json 与 schemas/*.json。",
    "不得由主协调器代写 return_packet 正文。"
  ],
  "dependency_notes": [
    "阶段4改造直接影响后续阶段5路由与阶段6验证。",
    "若出现 dispatch_message_raw 大面积失配，必须优先保兼容。"
  ],
  "done_signals": [
    "脚本编译逻辑支持可选角色上下文输入。",
    "当前 task validate 通过。",
    "return_packet 由执行子代理本人写入。"
  ],
  "verification_focus": [
    "新字段可选启用且缺省兼容。",
    "compile-dispatch-message 可成功回写阶段4工单。",
    "validate 不出现历史工单大面积不一致。"
  ],
  "fallback_strategy": [
    "若升级破坏兼容，回退到缺省行为并返回 blocked。",
    "若必须改阶段5文件，停止并回退主协调器。"
  ],
  "handoff_notes": [
    "完整填写 required_return_fields。",
    "验证命令与结果需可复核。",
    "written_by/written_role 必须标注执行子代理本人。"
  ]
}
